A1: America Saraswata Sangha | C1: Bhakta Sammilani 2013 | E1: Sammilani Date | F1: 41460
B2: Seva | C2: Coordinating Sevaka/ Sebika | D2: Sevaka/Sebika | E2: YA Sevaka/ Sebika | F2: Planning Start Date
A3: 1 | B3: Puja & archana | C3: Gyan Bhai | D3: Braja bhai Smita Ray maa Sibani Dwibedy Maa, Devi bhai Barada Bhai,Rabi Bhai | F3: =F$1-30 -> 41430
A4: =+A3+1 -> 2 | B4: Magazine Publication | C4: Biswajit bhai | D4: Braja bhai, Sanujit Bhai, Devi bhai,Rasmi C. Maa | F4: =F$1-180 -> 41280
A5: =+A4+1 -> 3 | B5: Sammilani Program | C5: Gyan Bhai | D5: "Braja bhai, Brundaban bhai, Biswajit bhai, Barada Bhai" | F5: =F$1-60 -> 41400
A6: =+A5+1 -> 4 | B6: Sangeeta | C6: Brundaban Bhai | D6: Gyan Bhai,Nihar bhai Biswajit bhai Smita Ray maa,Rasmi C. Maa, Sonali maa, Sibani Mohanty Maa, Bibhuti bhai Sudhansubala Maa, Smita Bai Maa, Dipti maa | E6: Siddharth, Bhakti,Aryaan | F6: =F$1-90 -> 41370
A7: =+A6+1 -> 5 | B7: Phula guntha & Phula Jogada | C7: Smita Bai Maa (Guntha) Biswajit bhai (Jogada) | D7: Sonali maa, Dipti maa Devi bhai, Snigdha Maa,Rasmi C. MaaSudhansubala maa,Tikili Maa, Smita Ray maa, | E7: Bhakti, Devangi, Shreya D | F7: =F$1-120 -> 41340
A8: =+A7+1 -> 6 | B8: Aasana sajja | C8: Sanghamitra Maa | D8: Gyan Bhai,Nihar Bhai Biswajit bhai Smita Ray maa, Sibani Dwibedy Maa Sonali maa, Soumya Bhai, Devi bhai,Mahesh Bhai Smita Bai Maa | E8: Devangi, Siddharth, Bhakti, Shreya D. | F8: =F$1-90 -> 41370
A9: =+A8+1 -> 7 | B9: Sabha Mandap Cleaning and Preparation | C9: Devi Bhai | D9: Sanujit Bhai, Soumya Bhai, Biswaranjan Bhai Prabhakar Bhai, Braja bhai | F9: =F$1-30 -> 41430
A10: =+A9+1 -> 8 | B10: Bhoga prastuti | C10: Sibani Dwibedy Maa Rashmi Panda Maa Sanujit Bhai (3rd day Lunch) | D10: Gyan Bhai, Subrat Bhai Sonali maa Smita Ray maa, Usha ma, Snigdha Maa, Banalata Maa,Rasmi C. MaaTikili Maa , Kalpana Maa, Sanghmitra maa, Dipti maa ,Geeta Ma | E10: Swati | F10: =F$1-60 -> 41400
A11: =+A10+1 -> 9 | B11: Cutting Vegetable | C11: Smita Ray Maa | D11: Gyan Bhai, Sibani Dwibedy Maa, Rashmi Panda maa, Dipti maa Sonali maa, Usha ma , Soumya Bhai, Subrat Bhai Snigdha Maa, Banalata Maa,Sudhansubala maa,Tikili Maa,Kalpana Maa Geeta Maa Smita Bai Maa | E11: Bhakti, Gyan | F11: =F$1-30 -> 41430
A12: =+A11+1 -> 10 | B12: Cleaning Dishes | C12: Barada Bhai | D12: Ashwini Bhai,Nihar Bhai, Rashmi Panda maa Smita Ray maa, Sibani Dwibedy Maa Sonali maa , Devi bhai, Soumya Bhai, Subrat Bhai, Snigdha Maa,Tikili Maa, Kalpana Maa, Dipti maa | F12: =F$1-30 -> 41430
A13: =+A12+1 -> 11 | B13: Prasada Bitarana | C13: Ashwini Bhai | D13: Gyan Bhai, Ashwini Bhai, Rashmi Panda maa, Soumya Bhai,Bibhuti bhai,Rama Bhai,Mahesh Bhai Prabhakar Bhai | E13: Devangi, Siddharth, Swati, Shreya D., Bhakti | F13: =F$1-30 -> 41430
A14: =+A13+1 -> 12 | B14: Clean up (Prasad Mandap) | C14: Devi Bhai | D14: Ashwini Bhai, Rashmi Panda maa, Soumya Bhai, Sibani Dwibedy Maa,Rama Bhai Prabhakar Bhai | E14: Swati | F14: =F$1-30 -> 41430
A15: =+A14+1 -> 13 | B15: Clean up (Rest Rooms) | C15: Devi Bhai | D15: Ashwini Bhai, Soumya Bhai, Gyan Bhai, Biswaranjan Bhai Prabhakar Bhai | E15: Swati | F15: =F$1-30 -> 41430
A16: =+A15+1 -> 14 | B16: Ananda Sabha | C16: Brajendra Nath Bhai, Gyan-ranjan Bhai, Brundaban Bhai | D16: Ashwini Bhai, Usha ma Biswajit bhai, Rashmi Panda maa, Rasmi C. Maa, Soumya Bhai, Barada Bhai Prabhakar Bhai | E16: Swati, Shreya D., Gyan, Bhakti | F16: =F$1-120 -> 41340
A17: =+A16+1 -> 15 | B17: Abhyarthana | C17: Ashwini Bhai | D17: Gyan Bhai, Sanujit Bhai Smita Ray maa Biswajit bhai | F17: =F$1-60 -> 41400
A18: =+A17+1 -> 16 | B18: Accommodation | C18: Ashwini Bhai | D18: Gyan Bhai, Sanujit Bhai | F18: =F$1-90 -> 41370
A19: =+A18+1 -> 17 | B19: Recording, video production,Event Photography | C19: Prabhakar Bhai | D19: Biswaranjan Bhai | F19: =F$1-30 -> 41430
A20: =+A19+1 -> 18 | B20: Sound system | C20: Prabhakar Bhai | F20: =F$1-30 -> 41430
A21: =+A20+1 -> 19 | B21: Baby sitting | C21: Prabhakar Bhai | D21: Snigdha Maa, Barada Bhai, Subrat Bhai | E21: Devangi, Bhakti, Gyan, Swati, Shreya D. | F21: =F$1-30 -> 41430
A22: =+A21+1 -> 20 | B22: Guests from India | C22: Gyan Bhai | D22: Smita Ray Maa, Sibani Dwibedy Maa, Brundaban bhai | F22: =F$1-90 -> 41370
A23: =+A22+1 -> 21 | B23: Grocery | C23: Sanujit Bhai | D23: Gyan Bhai Ashwini Bhai, Sibani Dwibedy Maa Prabhakar Bhai | F23: =F$1-60 -> 41400
A24: =+A23+1 -> 22 | B24: Finance | C24: Brajendra Bhai | D24: Gyan Bhai | F24: =F$1-120 -> 41340
A25: =+A24+1 -> 23 | B25: Charanamruta/Chandan | C25: Barada Bhai | E25: Gyan | F25: =F$1-30 -> 41430
B26: Updated: 6/21/13 | E26: www.jayaguru.net