C1: 9th Sammilani Seva list
B2: Seva | C2: Coordinating Sevaka/Sebika | D2: Sevaka/Sebika | E2: Planning Start Date | F2: Planning End Date | H2: 8th Sammilani Sevaka/Sebika
A3: 1 | B3: Magazine Publication | C3: Biswajit bhai | D3: Sibani Dwibedy Maa Rashmi Panda Maa, Brajendra Bhai, Barada Bhai, Rashmi C. Maa, Sanujit Bhai, Devi Bhai, Vedamati Maa, Debasis Bhai, Smita Ray Maa, Banalata Maa, Bijoy Bhai | E3: 40179 | H3: Sibani Dwibedy Maa Rashmi Panda Maa, Braja Bhai, Barada Bhai, Rashmi C. Maa, Sanujit Bhai, Devi Bhai, Ishwar Bhai Vedamati Maa, Debasis Bhai
A4: =+A3+1 -> 2 | B4: Sammilani Program | C4: Gyan Bhai | D4: Biswajit Bhai, Brajendra Bhai, Barada Bhai, Brundaban Bhai | E4: 40308 | H4: Bijoy bhai, Biswajit Bhai, Braja Bhai, Barada Bhai, Brundaban Bhai
A5: =+A4+1 -> 3 | B5: Sangeeta | C5: Gyan Bhai Brundaban Bhai | D5: Biswajit Bhai, Rashmi C Maa, Sudhansubala Maa, Smita Bai Maa, Smita Ray Maa, Debasis Bhai, Sibani M. Maa Subrat Bhai, Barada Bhai, Shreya | E5: 40304 | H5: Biswajit Bhai, Rashmi C. Maa, Sudhansubala Maa, Barada Bhai, Smita Bai Maa, Smita Ray Maa, Debasis Bhai
A6: =+A5+1 -> 4 | B6: Puja & archana | C6: Gyan Bhai | D6: Sibani Dwibedy Maa, Brajendra Bhai, Barada Bhai, Smita Ray Maa, Devi Bhai | E6: 40339 | H6: Sibani Dwibedy Maa, Braja Bhai, Barada Bhai, Smita Ray Maa
A7: =+A6+1 -> 5 | B7: Phula guntha & Phula Jogada | C7: Smita Bai Maa | D7: Sibani Dwibedy Maa, Barada Bhai, Biswajit Bhai Smita Ray Maa, Rashmi Nayak Maa, Sudhansubala Maa, Usha Maa, Shreya | E7: 40339 | H7: Sibani Dwibedy Maa, Barada Bhai, Smita Ray Maa, Sanghamitra Maa, Rashmi C. Maa, Sudhansubala Maa
A8: =+A7+1 -> 6 | B8: Aasana sajja | C8: Pruthwiraj bhai | D8: Biswajit Bhai, Sibani Dwibedy Maa, Ashwini Bhai, Sanghamitra Maa, Gyan Bhai Smita Bai Maa, Devi Bhai, Rashmi C. Maa, Debasis Bhai | E8: 40247 | H8: Biswajit Bhai, Sibani Dwibedy Maa, Ashwini Bhai, Sanghamitra Maa, Gyan Bhai Smita Bai Maa, Devi Bhai, Rashmi C. Maa, Debasis Bhai
A9: =+A8+1 -> 7 | B9: Bhoga prastuti | C9: Sibani Dwibedy Maa Smita Ray Maa Rashmi Panda Maa | D9: Rashmi C. Maa, Sudhansubala Maa, Subrat Bhai, Sonia Maa | E9: 40308 | H9: Sanghamitra Maa, Rashmi C. Maa, Sudhansubala Maa
A10: =+A9+1 -> 8 | B10: Cutting Vegetable | C10: Smita Ray Maa | D10: Sibani Dwibedy Maa, Rashmi Panda Maa, Gyan Bhai, Sudhansubala Maa, Smita Bai Maa, Subrat Bhai, Sonia Maa, Sushree Maa, Usha Maa | E10: 40339 | H10: Sibani Dwibedy Maa, Smita Ray Maa, Sanghamitra Maa, Gyan Bhai, Sudhansubala Maa, Smita Bai Maa
A11: =+A10+1 -> 9 | B11: Cleaning Dishes | C11: Barada Bhai | D11: Sibani Dwibedy Maa, Smita Ray Maa, Rashmi Panda Maa, Sudhansubala Maa, Bijoy Bhai, Subrat Bhai, Sonia Maa, Sushree Maa | E11: 40369 | H11: Sibani Dwibedy Maa, Smita Ray Maa, Sanghamitra Maa, Gyan Bhai, Sudhansubala Maa, Smita Bai Maa, Bijoy Bhai
A12: =+A11+1 -> 10 | B12: Prasada Bitarana | C12: Ashwini Bhai | D12: Barada Bhai, Pruthwiraj Bhai, Gyan Bhai, Prabhakar Bhai, Devi Bhai, Biswaranjan Bhai, Subrat Bhai, Rashmi Panda Maa, Usha Maa, Shreya | E12: 40369 | H12: Barada Bhai, Pruthwiraj Bhai, Gyan Bhai, Prabhakar Bhai, Devi Bhai, Biswaranjan Bhai
A13: =+A12+1 -> 11 | B13: Clean up | C13: Devi Bhai | D13: Gyan Bhai, Prabhakar Bhai, Devi Bhai, Ashwini Bhai, Sibani Dwibedy Maa, Rashmi Panda Maa | E13: 40369 | H13: Gyan Bhai, Prabhakar Bhai, Devi Bhai, Ashwini Bhai, Sibani Dwibedy Maa
A14: =+A13+1 -> 12 | B14: Ananda Sabha | C14: Brajendra Bhai, Gyan Bhai, Brundaban Bhai | D14: Biswajit Bhai, Barada Bhai, Subrat Bhai, Pruthwiraj Bhai, Ashwini Bhai, Prabhakar Bhai, Devi Bhai, Debasis Bhai, Rashmi C. Maa, Sonia Maa | E14: 40278 | H14: Biswajit Bhai, Barada Bhai, Pruthwiraj Bhai, Ashwini Bhai, Prabhakar Bhai, Devi Bhai, Rashmi C. Maa
A15: =+A14+1 -> 13 | B15: Abhyarthana | C15: Ashwin Bhai | D15: Biswajit Bhai, Gyan Bhai, Sibani Dwibedy Maa, Smita Ray Maa | E15: 40339 | H15: Biswajit Bhai, Sanghamitra Maa, Gyan Bhai
A16: =+A15+1 -> 14 | B16: Accommodation | C16: Ashwini Bhai | D16: Gyan Bhai | E16: 40219 | H16: Gyan Bhai
A17: =+A16+1 -> 15 | B17: Recording, video production | C17: Prabhakar Bhai | D17: Devi Bhai, Debasis Bhai | E17: 40339 | H17: Devi Bhai, Debasis Bhai
A18: =+A17+1 -> 16 | B18: Sound system | C18: Prabhakar Bhai | E18: 40339 | H18: Biswaranjan Bhai
A19: =+A18+1 -> 17 | B19: Baby sitting | C19: Prabhakar Bhai | D19: Barada Bhai, Ashwini Bhai | E19: 40369 | H19: Sibani Dwibedy Maa, Barada Bhai, Ashwini Bhai
A20: =+A19+1 -> 18 | B20: Guests from India | C20: Gyan Bhai | D20: Bijoy Bhai, Biswajit Bhai, Sibani Dwibedy Maa, Barada Bhai, Smita Ray Maa, Ashwini Bhai, Brundaban Bhai | E20: 40247 | H20: Bijoy Bhai, Biswajit Bhai, Sibani Dwibedy Maa, Barada Bhai, Smita Ray Maa, Ashwini Bhai, Brundaban Bhai
A21: =+A20+1 -> 19 | B21: Grocery | C21: Biswajit bhai | D21: Smita Ray Maa, Prabhakar Bhai, Sibani Dwibedy Maa | E21: 40308 | H21: Smita Ray Maa, Ashwini Bhai, Prabhakar Bhai, Sibani Dwibedy Maa
A22: =+A21+1 -> 20 | B22: Finance | C22: Brajendra Bhai | D22: Bijoy Bhai, Gyan Bhai | E22: 40247 | H22: Bijoy Bhai, Gyan Bhai